<?xml version="1.0" encoding="UTF-8"?>
<overlay xmlns:xsi="http://www.w3.org/2001/XMLSchema-instance" xsi:noNamespaceSchemaLocation="Overlay.xsd" typ="FAQ" webtauglich="true" title="Häufige Fragen">
    <text verfasser="tjj">
        <p/>
        <p>
            <hi rend="h1">Häufige Fragen</hi>
        </p>
        <p>
            <hi rend="h2">Allgemein</hi>
        </p>
        <p/>
        <p>
            <hi rend="h2">Is there an English version of this website?</hi>
        </p>
        <p>There is only a German version at the moment.
        </p>
        <p>
            <hi rend="h3">Was ist das Projekt Corpus Coranicum?</hi>
        </p>
        <p>Zum Projekt Corpus Coranicum und zu seinen einzelnen Modulen finden Sie hier (http://corpuscoranicum.de/) Informationen.</p>
        <p>
            <hi rend="h3">Was bietet diese Onlinepublikation?</hi>
        </p>
        <p>Diese Publikation bietet die Ergebnisse der einzelnen Arbeitsmodule des Projekts Corpus Coranicum. Sie beinhaltet erstens eine Dokumentation des Korantextes in seiner handschriftlichen und mündlichen Überlieferungsgestalt, zweitens eine umfassende Datenbank von jüdischen, christlichen, altarabischen und anderen Texten zu einzelnen Koranstellen aus der Umwelt des Korans (TUK) und drittens einen ausführlichen chronologisch - literaturwissenschaftlichen Kommentar.</p>
        <p>
            <hi rend="h3">Wo kann ich generelle Informationen über die Projektmodule finden?</hi>
        </p>
        <p>Allgemeine Informationen über die einzelnen Projektmodule entnehmen Sie bitte dem Textfeld, das sich beim Anklicken des Buttons „Übersicht – Einleitung – Register“ (rechts oben innerhalb der Registerkarte des jeweiligen Moduls) öffnet. Dort finden Sie Informationen zum Stand der Bearbeitung in Form eines Überblicks, eine allgemeine Einleitung in das jeweilige Modul und ggf. weitere Informationen.</p>
        <p>
            <hi rend="h3">Was ist eine Betaversion?</hi>
        </p>
        <p>Diese komplexe, teilweise dynamisch generierte Webseite befindet sich derzeit noch in einer Testphase. Einzelne technische Probleme sind noch nicht behoben. Fehler können unter Umständen auftreten. Deswegen ist diese Webseite als Betaversion gekennzeichnet.</p>
        <p>
            <hi rend="h3">Welche technischen Voraussetzungen sind nötig, um die Webseite benutzen zu können?</hi>
        </p>
        <p>Es werden ein Web 2.0 –fähiger Browser (etwa Firefox, Safari, Internet Explorer, Opera), Sonderzeichen (nicht-ASCII) und nichtlateinische Schriften benötigt. Je nach persönlichen Browsereinstellungen kann es leider dennoch zu Darstellungsschwierigkeiten kommen.</p>
        <p>Für die korrekte Darstellung der nichtlateinischen Zeichen und Schriften ist es nötig, den Font „Coranica“ zu installieren.</p>
        <p>
            <hi rend="h3">Warum wird der arabische Text nicht richtig angezeigt?</hi>
        </p>
        <p>Für die korrekte Darstellung der nichtlateinischen Zeichen und Schriften ist es nötig, den Font „Coranica” zu installieren.</p>
        <p>
            <hi rend="h3">Warum gibt es zu einem Vers nicht in allen Modulen Daten?</hi>
        </p>
        <p>Die verschiedenen Projektmodule bearbeiten nicht zeitgleich dieselben Suren und Verse. Diese asynchrone Arbeitsweise war für die erste Bearbeitungsphase angesichts der Erfordernisse der verschiedenen Module das praktikabelste Vorgehen. In Zukunft wird eine Synchronisierung der Bearbeitungsschwerpunkte angestrebt.</p>
        <p>
            <hi rend="h3">Gibt es eine Suchfunktion?</hi>
        </p>
        <p>Bis jetzt gibt es noch keine allgemeine Suchfunktion.</p>
        <p>
            <hi rend="h3">Kann ich eine Druckansicht von den Daten erstellen, die ich abgerufen habe?</hi>
        </p>
        <p>Es ist möglich, eine Druckansicht von abgerufenen Daten zu erstellen. Klicken Sie dazu auf den Button „Drucken“ in der Navigation auf der linken Seite der Webseite.
        </p>
        <p>
            <hi rend="h3">Gibt es eine Benachrichtigungsfunktion, falls auf der Seite Änderungen vorgenommen werden?</hi>
        </p>
        <p>Derzeit steht diese Möglichkeit noch nicht zur Verfügung.</p>
        <p>
            <hi rend="h3">Warum ist die Übersetzung, die man  in der Navigation sieht (= Paret), eine andere als die im Kommentar (z. B. Sinai)?</hi>
        </p>
        <p>Im Zuge der Kommentierung des Korantextes wird eine projekteigene Übersetzung angefertigt, die die Ergebnisse der Projektarbeit integriert. Da diese Übersetzung jedoch erst mit der Kommentierung der letzten Suren abgeschlossen sein wird, kann sie vorerst noch nicht für alle Suren im entsprechenden Feld der Navigation angezeigt werden. Um das Auffinden und den Abgleich von Koranstellen dennoch zu ermöglichen, wird übergangsweise die Koranübersetzung von Rudi Paret (1979) zur Verfügung gestellt.</p>
        <p>
            <hi rend="h3">Wer ist verantwortlich für diese Webseite?</hi>
        </p>
        <p>Für die Inhalte dieser Webseite zeigen sich die Mitarbeiter des Projekts Corpus Coranicum verantwortlich. In den einzelnen Modulen werden Verfasser von Anmerkungen, Kommentaren oder Übersetzungen namentlich genannt.   
        </p>
        <p>
            <hi rend="h3">An wen richtet sich diese Webseite?</hi>
        </p>
        <p>Diese Webseite richtet sich an alle an der Koranforschung Interessierten. Laien ebenso wie Wissenschaftler sind eingeladen, die hier präsentierten Ergebnisse des akademischen Forschungsvorhabens Corpus Coranicum zu erkunden.
        </p>
        <p>
            <hi rend="h3">An wen kann ich mich bei Fragen wenden?</hi>
        </p>
        <p>Bei Fragen und Problemen wenden Sie sich bitte an folgende E-Mail-Adresse: corpuscoranicum@bbaw.de.</p>
        <p>Wir werden versuchen, Ihre E-Mail so schnell wie möglich zu beantworten. Allerdings kann es in Abhängigkeit vom E-Mail-Aufkommen zu etwas längeren Bearbeitungszeiten kommen. Wir bitten Sie um Ihr Verständnis.</p>
        <p>
            <hi rend="h3">Wie zitiere ich Informationen von dieser Webseite?</hi>
        </p>
        <p>Herausgeber, Verfasser, Bearbeiter oder Übersetzer sind bei allen Daten jeweils aufgeführt und sollten neben der Angabe der vollständigen Webadresse mit angegeben werden. Da es sich bei der Webseite noch um eine Betaversion handelt, sollte jeweils auch das genaue Datum, an dem eine Information abgerufen wurde, mit angeführt werden.</p>
        <p>Gibt es Anwendungsbeispiele? (Video – Michael , N.N.)</p>
        <p/>
        <p>
            <hi rend="h2">Handschriften</hi>
        </p>
        <p>
            <hi rend="h3">Wie viele Koranhandschriften sind derzeit in der Datenbank erfasst?</hi>
        </p>
        <p>Momentan sind ca. 350 Handschriften erfasst, wovon in etwa 70 auch schon für die Online-Publikation freigeschaltet worden sind. Dabei umfassen diese Einträge teilsweise nur ein einzelnes Blatt, teilsweise aber auch mehrere hundert Blätter (z. B. Kodex Wetzstein: 210 fol., Sayyida Zainab: 1087 fol.).</p>
        <p>
            <hi rend="h3">Wie alt ist die älteste datierte Koranhandschrift, die hier eingesehen werden kann?</hi>
        </p>
        <p>??? (Michael)</p>
        <p>
            <hi rend="h3">Wo werden die hier aufgeführten Koranhandschriften aufbewahrt?</hi>
        </p>
        <p>Die Originalhandschriften befinden sich zum einen in öffentlichen Bibliotheken und Museen und zum anderen in privaten Sammlungen. Hie sind insbesondere Bibliotheken in Berlin, Paris, London, St. Petersburg, Tübingen zu nennen. Wichtige Handschriften sind auch in den Museen in Istanbul, Qatar, Bahrain, Chicago aufbewahrt. Für die Erfassung in der Handschriftendatenbank werden bereits vorhandene Digitalisate eingekauft, bzw.  beauftragt.</p>
        <p>
            <hi rend="h3">Was ist das Ziel der Erfassung von Koranhandschriften?</hi>
        </p>
        <p>Die Handschriften werden in einer Datenbank erfasst, wozu möglichst von jeder Seite eine digitale Abbildung in hoher Qualität gehört, auf deren Basis anschließend eine exakte Transliteration des Textes erstellt und gespeichert wird. Diese ermöglichen anschließend einen Vergleich zwischen einzelnen Handschriften und damit auch eine genaue Dokumentation der Entwicklung der Textgestalt des Korans in den Handschriften.</p>
        <p>
            <hi rend="h2">Lesarten (Michael)</hi>
        </p>
        <p>
            <hi rend="h3">Was ist eine Lesart?</hi>
        </p>
        <p/>
        <p>
            <hi rend="h3">Haben Lesarten mit verschiedenen Dialekten zu tun?</hi>
        </p>
        <p/>
        <p>
            <hi rend="h3">Auf welcher Quelle basieren die Lesarten?</hi>
        </p>
        <p/>
        <p>
            <hi rend="h3">Gibt es zwischen Lesarten und Koranhandschriften Differenzen?</hi>
        </p>
        <p/>
        <p>
            <hi rend="h3">Gibt es einen Lesarten-Kanon?</hi>
        </p>
        <p/>
        <p>
            <hi rend="h3">Was ist das Ziel der Erfassung von Lesarten?</hi>
        </p>
        <p/>
        <p>
            <hi rend="h2">Texte aus der Umwelt des Korans (David)</hi>
        </p>
        <p/>
        <p>
            <hi rend="h3">Was ist ein TUK?</hi>
        </p>
        <p>TUK steht für Text(e) aus der Umwelt des Korans. Es handelt sich um Texte, welche im zeitlichen, räumlichen und kulturellen Umfeld des Korans angesiedelt sind und Bezüge zum Korantext aufweisen. Ausführlichere Informationen entnehmen Sie bitte dem Textfeld, das sich beim Anklicken des Buttons „Übersicht – Einleitung – Register“ (rechts oben innerhalb der Registerkarte des jeweiligen Moduls) öffnet.</p>
        <p>
            <hi rend="h3">Werden originalsprachige Texte übersetzt?</hi>
        </p>
        <p>Ja, alle Originaltexte sind ins Deutsche übersetzt.</p>
        <p>
            <hi rend="h3">Wie kann ich mir TUK anzeigen lassen?</hi>
        </p>
        <p>Im Augenblick gibt es zwei Vorgehensweisen:</p>